{
  "schema_version": "investor_profile/1",
  "profile_id": "inv-prof-syn-tandoval-pay",
  "status": "frozen",
  "as_of": "2026-10-08",
  "provenance": {
    "documents": [],
    "built_by": "llm",
    "builder_id": "claude-context-A-profile-builder",
    "builder_saw_investors": false
  },
  "fields": {
    "name": {
      "value": "Tandoval Pay (SYN)",
      "source": "synthetic",
      "as_of": "2026-10-08",
      "quote": null
    },
    "incorporation_country": {
      "value": "Mexico",
      "source": "synthetic",
      "as_of": "2026-10-08",
      "quote": null
    },
    "operating_regions": {
      "value": [
        "Mexico"
      ],
      "source": "synthetic",
      "as_of": "2026-10-08",
      "quote": null
    },
    "sector": {
      "value": "Fintech",
      "source": "synthetic",
      "as_of": "2026-10-08",
      "quote": null
    },
    "subsectors": {
      "value": [
        "B2B payments",
        "SME working capital",
        "embedded lending"
      ],
      "source": "synthetic",
      "as_of": "2026-10-08",
      "quote": null
    },
    "product": {
      "value": "Accounts-payable and supplier-financing platform for independent restaurants and their food distributors",
      "source": "synthetic",
      "as_of": "2026-10-08",
      "quote": null
    },
    "description": {
      "value": "Tandoval Pay lets small restaurants pay food distributors on 30-day terms while distributors get paid upfront. The platform digitises invoices from CFDI e-invoicing data and underwrites short-term credit using purchase history. Revenue comes from distributor fees and interest spread.",
      "source": "synthetic",
      "as_of": "2026-10-08",
      "quote": null
    },
    "customer_type": {
      "value": [
        "SME",
        "B2B distributors"
      ],
      "source": "synthetic",
      "as_of": "2026-10-08",
      "quote": null
    },
    "business_model": {
      "value": [
        "transaction fees",
        "interest spread",
        "SaaS subscription"
      ],
      "source": "synthetic",
      "as_of": "2026-10-08",
      "quote": null
    },
    "product_stage": {
      "value": "live product with paying customers",
      "source": "synthetic",
      "as_of": "2026-10-08",
      "quote": null
    },
    "funding_stage": {
      "value": "seed",
      "source": "synthetic",
      "as_of": "2026-10-08",
      "quote": null
    },
    "round_sought": {
      "value": "Seed (priced equity)",
      "source": "synthetic",
      "as_of": "2026-10-08",
      "quote": null
    },
    "capital_sought_usd": {
      "value": 2500000,
      "source": "synthetic",
      "as_of": "2026-10-08",
      "quote": null
    },
    "revenue_or_traction": {
      "value": "synthetic: USD 1.1M monthly payment volume, 640 active restaurants, 38 distributors, ~USD 45k MRR, 0.9% 90-day default rate",
      "source": "synthetic",
      "as_of": "2026-10-08",
      "quote": null
    },
    "relevant_regulation": {
      "value": [
        "Mexican Ley Fintech",
        "CNBV oversight for lending activity",
        "SAT CFDI e-invoicing rules",
        "AML/KYC (LFPIORPI)"
      ],
      "source": "synthetic",
      "as_of": "2026-10-08",
      "quote": null
    },
    "target_markets": {
      "value": [
        "Mexico"
      ],
      "source": "synthetic",
      "as_of": "2026-10-08",
      "quote": null
    },
    "lead_preference": {
      "value": "seeking lead",
      "source": "synthetic",
      "as_of": "2026-10-08",
      "quote": null
    },
    "accepted_investor_types": {
      "value": [
        "generalist_vc",
        "specialist_vc"
      ],
      "source": "synthetic",
      "as_of": "2026-10-08",
      "quote": null
    },
    "excluded_investors": {
      "value": [],
      "source": "synthetic",
      "as_of": "2026-10-08",
      "quote": null
    },
    "restrictions": {
      "value": [
        "credit facility to be raised separately as debt; equity round not for loan book"
      ],
      "source": "synthetic",
      "as_of": "2026-10-08",
      "quote": null
    },
    "known_portfolio_conflicts": {
      "value": [],
      "source": "synthetic",
      "as_of": "2026-10-08",
      "quote": null
    },
    "comparable_companies": {
      "value": [
        "Konfio"
      ],
      "source": "synthetic",
      "as_of": "2026-10-08",
      "quote": null
    }
  }
}
