{
  "schema_version": "investor_profile/1",
  "profile_id": "inv-prof-syn-nuravolt-asia",
  "status": "frozen",
  "as_of": "2026-10-08",
  "provenance": {
    "documents": [],
    "built_by": "llm",
    "builder_id": "claude-context-A-profile-builder",
    "builder_saw_investors": false
  },
  "fields": {
    "name": {
      "value": "Nuravolt Asia (SYN)",
      "source": "synthetic",
      "as_of": "2026-10-08",
      "quote": null
    },
    "incorporation_country": {
      "value": "Singapore",
      "source": "synthetic",
      "as_of": "2026-10-08",
      "quote": null
    },
    "operating_regions": {
      "value": [
        "Vietnam",
        "Philippines",
        "Singapore"
      ],
      "source": "synthetic",
      "as_of": "2026-10-08",
      "quote": null
    },
    "sector": {
      "value": "Distributed energy",
      "source": "synthetic",
      "as_of": "2026-10-08",
      "quote": null
    },
    "subsectors": {
      "value": [
        "rooftop solar",
        "battery storage",
        "energy monitoring software"
      ],
      "source": "synthetic",
      "as_of": "2026-10-08",
      "quote": null
    },
    "product": {
      "value": "Rooftop solar and battery leasing for SME factories with software-based energy monitoring",
      "source": "synthetic",
      "as_of": "2026-10-08",
      "quote": null
    },
    "description": {
      "value": "Nuravolt Asia installs and owns rooftop solar plus battery systems on small and mid-sized factories in Vietnam and the Philippines, selling power under long-term leases. Its monitoring software optimises self-consumption and reports emissions for export customers' supply-chain audits. The Series A funds the origination team and software platform.",
      "source": "synthetic",
      "as_of": "2026-10-08",
      "quote": null
    },
    "customer_type": {
      "value": [
        "SME manufacturers",
        "industrial parks"
      ],
      "source": "synthetic",
      "as_of": "2026-10-08",
      "quote": null
    },
    "business_model": {
      "value": [
        "solar leasing / PPA",
        "SaaS monitoring fees"
      ],
      "source": "synthetic",
      "as_of": "2026-10-08",
      "quote": null
    },
    "product_stage": {
      "value": "scaling commercial deployment",
      "source": "synthetic",
      "as_of": "2026-10-08",
      "quote": null
    },
    "funding_stage": {
      "value": "series_a",
      "source": "synthetic",
      "as_of": "2026-10-08",
      "quote": null
    },
    "round_sought": {
      "value": "Series A (priced equity)",
      "source": "synthetic",
      "as_of": "2026-10-08",
      "quote": null
    },
    "capital_sought_usd": {
      "value": 8000000,
      "source": "synthetic",
      "as_of": "2026-10-08",
      "quote": null
    },
    "revenue_or_traction": {
      "value": "synthetic: 46 MWp contracted, 29 MWp operating across 140 sites, USD 3.1M annual revenue, 95% on-time payments",
      "source": "synthetic",
      "as_of": "2026-10-08",
      "quote": null
    },
    "relevant_regulation": {
      "value": [
        "Vietnam DPPA and rooftop solar regulations",
        "Philippines Net-Metering rules (ERC)",
        "Singapore Companies Act"
      ],
      "source": "synthetic",
      "as_of": "2026-10-08",
      "quote": null
    },
    "target_markets": {
      "value": [
        "Vietnam",
        "Philippines"
      ],
      "source": "synthetic",
      "as_of": "2026-10-08",
      "quote": null
    },
    "lead_preference": {
      "value": "seeking lead",
      "source": "synthetic",
      "as_of": "2026-10-08",
      "quote": null
    },
    "accepted_investor_types": {
      "value": [
        "climate_vc",
        "impact_investor"
      ],
      "source": "synthetic",
      "as_of": "2026-10-08",
      "quote": null
    },
    "excluded_investors": {
      "value": [],
      "source": "synthetic",
      "as_of": "2026-10-08",
      "quote": null
    },
    "restrictions": {
      "value": [
        "project assets held in local SPVs financed with separate debt"
      ],
      "source": "synthetic",
      "as_of": "2026-10-08",
      "quote": null
    },
    "known_portfolio_conflicts": {
      "value": [],
      "source": "synthetic",
      "as_of": "2026-10-08",
      "quote": null
    },
    "comparable_companies": {
      "value": null,
      "source": "synthetic",
      "as_of": "2026-10-08",
      "quote": null
    }
  }
}
