{
  "schema_version": "investor_profile/1",
  "profile_id": "inv-prof-syn-corvanta-mobility",
  "status": "frozen",
  "as_of": "2026-10-08",
  "provenance": {
    "documents": [],
    "built_by": "llm",
    "builder_id": "claude-context-A-profile-builder",
    "builder_saw_investors": false
  },
  "fields": {
    "name": {
      "value": "Corvanta Mobility (SYN)",
      "source": "synthetic",
      "as_of": "2026-10-08",
      "quote": null
    },
    "incorporation_country": {
      "value": "Brazil",
      "source": "synthetic",
      "as_of": "2026-10-08",
      "quote": null
    },
    "operating_regions": {
      "value": [
        "Brazil"
      ],
      "source": "synthetic",
      "as_of": "2026-10-08",
      "quote": null
    },
    "sector": {
      "value": "Electric mobility",
      "source": "synthetic",
      "as_of": "2026-10-08",
      "quote": null
    },
    "subsectors": {
      "value": [
        "electric cargo vehicles",
        "battery swapping",
        "urban logistics"
      ],
      "source": "synthetic",
      "as_of": "2026-10-08",
      "quote": null
    },
    "product": {
      "value": "Electric cargo three-wheelers with battery-swap stations, leased to last-mile delivery fleets",
      "source": "synthetic",
      "as_of": "2026-10-08",
      "quote": null
    },
    "description": {
      "value": "Corvanta Mobility designs and assembles electric cargo three-wheelers in Sao Paulo state and operates a network of battery-swap stations. Fleets pay a per-vehicle monthly lease plus per-swap energy fees. The Series B finances a second assembly line and expansion to four new metro areas.",
      "source": "synthetic",
      "as_of": "2026-10-08",
      "quote": null
    },
    "customer_type": {
      "value": [
        "enterprise fleets",
        "logistics companies"
      ],
      "source": "synthetic",
      "as_of": "2026-10-08",
      "quote": null
    },
    "business_model": {
      "value": [
        "vehicle leasing",
        "energy-as-a-service",
        "hardware sales"
      ],
      "source": "synthetic",
      "as_of": "2026-10-08",
      "quote": null
    },
    "product_stage": {
      "value": "scaling commercial deployment",
      "source": "synthetic",
      "as_of": "2026-10-08",
      "quote": null
    },
    "funding_stage": {
      "value": "series_b",
      "source": "synthetic",
      "as_of": "2026-10-08",
      "quote": null
    },
    "round_sought": {
      "value": "Series B (priced equity)",
      "source": "synthetic",
      "as_of": "2026-10-08",
      "quote": null
    },
    "capital_sought_usd": {
      "value": 30000000,
      "source": "synthetic",
      "as_of": "2026-10-08",
      "quote": null
    },
    "revenue_or_traction": {
      "value": "synthetic: 2,300 vehicles deployed, 85 swap stations, USD 14M annualised revenue, 2.4x YoY growth, 7 enterprise fleet contracts",
      "source": "synthetic",
      "as_of": "2026-10-08",
      "quote": null
    },
    "relevant_regulation": {
      "value": [
        "INMETRO vehicle homologation",
        "CONTRAN road-safety rules",
        "ANEEL rules on energy resale"
      ],
      "source": "synthetic",
      "as_of": "2026-10-08",
      "quote": null
    },
    "target_markets": {
      "value": [
        "Brazil"
      ],
      "source": "synthetic",
      "as_of": "2026-10-08",
      "quote": null
    },
    "lead_preference": {
      "value": "seeking lead",
      "source": "synthetic",
      "as_of": "2026-10-08",
      "quote": null
    },
    "accepted_investor_types": {
      "value": [
        "growth_investor",
        "climate_vc",
        "generalist_vc"
      ],
      "source": "synthetic",
      "as_of": "2026-10-08",
      "quote": null
    },
    "excluded_investors": {
      "value": [],
      "source": "synthetic",
      "as_of": "2026-10-08",
      "quote": null
    },
    "restrictions": {
      "value": [
        "vehicle asset finance expected via separate debt facility"
      ],
      "source": "synthetic",
      "as_of": "2026-10-08",
      "quote": null
    },
    "known_portfolio_conflicts": {
      "value": [],
      "source": "synthetic",
      "as_of": "2026-10-08",
      "quote": null
    },
    "comparable_companies": {
      "value": null,
      "source": "synthetic",
      "as_of": "2026-10-08",
      "quote": null
    }
  }
}
