{
  "schema_version": "investor_profile/1",
  "profile_id": "inv-prof-syn-soufrene-cardiocare",
  "status": "frozen",
  "as_of": "2026-10-08",
  "provenance": {
    "documents": [],
    "built_by": "llm",
    "builder_id": "claude-context-A-profile-builder",
    "builder_saw_investors": false
  },
  "fields": {
    "name": {
      "value": "Soufrene Cardiocare (SYN)",
      "source": "synthetic",
      "as_of": "2026-10-08",
      "quote": null
    },
    "incorporation_country": {
      "value": "Saint Lucia",
      "source": "synthetic",
      "as_of": "2026-10-08",
      "quote": null
    },
    "operating_regions": {
      "value": [
        "Saint Lucia"
      ],
      "source": "synthetic",
      "as_of": "2026-10-08",
      "quote": null
    },
    "sector": {
      "value": "Healthcare delivery",
      "source": "synthetic",
      "as_of": "2026-10-08",
      "quote": null
    },
    "subsectors": {
      "value": [
        "cardiac catheterisation",
        "radiation oncology",
        "private specialist hospital"
      ],
      "source": "synthetic",
      "as_of": "2026-10-08",
      "quote": null
    },
    "product": {
      "value": "Private tertiary care centre with a cath lab, linear accelerator and 40 inpatient beds, plus tele-follow-up software for discharged patients",
      "source": "synthetic",
      "as_of": "2026-10-08",
      "quote": null
    },
    "description": {
      "value": "Soufrene Cardiocare builds and runs the island's first combined cardiac catheterisation and radiotherapy centre, so patients no longer need medical evacuation abroad. It is paid by private insurers, the national health insurance scheme and self-pay patients. Hospital and radiation-source licences are issued only to locally incorporated operators.",
      "source": "synthetic",
      "as_of": "2026-10-08",
      "quote": null
    },
    "customer_type": {
      "value": [
        "private health insurers",
        "national health insurance scheme",
        "self-pay patients"
      ],
      "source": "synthetic",
      "as_of": "2026-10-08",
      "quote": null
    },
    "business_model": {
      "value": [
        "fee-for-service",
        "insurer contracts",
        "outpatient tele-follow-up subscription"
      ],
      "source": "synthetic",
      "as_of": "2026-10-08",
      "quote": null
    },
    "product_stage": {
      "value": "Outpatient cardiology clinic operating; hospital wing under construction",
      "source": "synthetic",
      "as_of": "2026-10-08",
      "quote": null
    },
    "funding_stage": {
      "value": "series_a",
      "source": "synthetic",
      "as_of": "2026-10-08",
      "quote": null
    },
    "round_sought": {
      "value": "Series A (priced equity)",
      "source": "synthetic",
      "as_of": "2026-10-08",
      "quote": null
    },
    "capital_sought_usd": {
      "value": 22000000,
      "source": "synthetic",
      "as_of": "2026-10-08",
      "quote": null
    },
    "revenue_or_traction": {
      "value": "synthetic: outpatient clinic US$3.4M revenue last 12 months, 9,800 consultations, contracts with 4 insurers, ~600 evacuations/year addressable",
      "source": "synthetic",
      "as_of": "2026-10-08",
      "quote": null
    },
    "relevant_regulation": {
      "value": [
        "private hospital licence (local entity required)",
        "radiation source licensing",
        "national health insurance accreditation"
      ],
      "source": "synthetic",
      "as_of": "2026-10-08",
      "quote": null
    },
    "target_markets": {
      "value": [
        "Saint Lucia"
      ],
      "source": "synthetic",
      "as_of": "2026-10-08",
      "quote": null
    },
    "lead_preference": {
      "value": "seeking lead",
      "source": "synthetic",
      "as_of": "2026-10-08",
      "quote": null
    },
    "accepted_investor_types": {
      "value": [
        "impact_investor",
        "growth_investor",
        "healthcare strategic operators"
      ],
      "source": "synthetic",
      "as_of": "2026-10-08",
      "quote": null
    },
    "excluded_investors": {
      "value": [],
      "source": "synthetic",
      "as_of": "2026-10-08",
      "quote": null
    },
    "restrictions": {
      "value": [
        "must remain Saint Lucia-incorporated to hold hospital and radiation licences"
      ],
      "source": "synthetic",
      "as_of": "2026-10-08",
      "quote": null
    },
    "known_portfolio_conflicts": {
      "value": [],
      "source": "synthetic",
      "as_of": "2026-10-08",
      "quote": null
    },
    "comparable_companies": {
      "value": null,
      "source": "synthetic",
      "as_of": "2026-10-08",
      "quote": null
    }
  }
}
