{
  "schema_version": "investor_profile/1",
  "profile_id": "inv-prof-dbg-fermora",
  "status": "frozen",
  "as_of": "2026-10-09",
  "provenance": {
    "documents": [],
    "built_by": "llm",
    "builder_id": "claude-v4-debug-profile-builder",
    "builder_saw_investors": false
  },
  "fields": {
    "name": {
      "value": "Fermora (SYN)",
      "source": "synthetic",
      "as_of": "2026-10-09",
      "quote": null
    },
    "incorporation_country": {
      "value": "Sweden",
      "source": "synthetic",
      "as_of": "2026-10-09",
      "quote": null
    },
    "operating_regions": {
      "value": [
        "Sweden",
        "Finland"
      ],
      "source": "synthetic",
      "as_of": "2026-10-09",
      "quote": null
    },
    "sector": {
      "value": "Foodtech",
      "source": "synthetic",
      "as_of": "2026-10-09",
      "quote": null
    },
    "subsectors": {
      "value": [
        "precision fermentation",
        "alternative protein",
        "B2B food ingredients"
      ],
      "source": "synthetic",
      "as_of": "2026-10-09",
      "quote": null
    },
    "product": {
      "value": "Fermentation-derived protein ingredient for dairy-alternative and bakery manufacturers",
      "source": "synthetic",
      "as_of": "2026-10-09",
      "quote": null
    },
    "description": {
      "value": "Fermora produces a functional protein by precision fermentation in a pilot plant in Sweden and sells it as an ingredient to food manufacturers in the Nordics. The Series A funds a demonstration-scale fermentation line in Finland and regulatory dossiers.",
      "source": "synthetic",
      "as_of": "2026-10-09",
      "quote": null
    },
    "customer_type": {
      "value": [
        "food manufacturers"
      ],
      "source": "synthetic",
      "as_of": "2026-10-09",
      "quote": null
    },
    "business_model": {
      "value": [
        "B2B ingredient sales"
      ],
      "source": "synthetic",
      "as_of": "2026-10-09",
      "quote": null
    },
    "product_stage": {
      "value": "pilot production with first commercial contracts",
      "source": "synthetic",
      "as_of": "2026-10-09",
      "quote": null
    },
    "funding_stage": {
      "value": "series_a",
      "source": "synthetic",
      "as_of": "2026-10-09",
      "quote": null
    },
    "round_sought": {
      "value": "Series A (priced equity)",
      "source": "synthetic",
      "as_of": "2026-10-09",
      "quote": null
    },
    "capital_sought_usd": {
      "value": 9300000,
      "source": "synthetic",
      "as_of": "2026-10-09",
      "quote": null
    },
    "revenue_or_traction": {
      "value": "synthetic: EUR 8M round (USD 9.3M at an assumed 1.16 EUR/USD); 3 signed offtake LOIs; pilot output 2 t/month",
      "source": "synthetic",
      "as_of": "2026-10-09",
      "quote": null
    },
    "relevant_regulation": {
      "value": [
        "EU Novel Food Regulation (EU) 2015/2283",
        "EFSA safety assessment"
      ],
      "source": "synthetic",
      "as_of": "2026-10-09",
      "quote": null
    },
    "target_markets": {
      "value": [
        "Sweden",
        "Finland"
      ],
      "source": "synthetic",
      "as_of": "2026-10-09",
      "quote": null
    },
    "lead_preference": {
      "value": "seeking lead",
      "source": "synthetic",
      "as_of": "2026-10-09",
      "quote": null
    },
    "accepted_investor_types": {
      "value": [
        "specialist_vc",
        "impact_investor",
        "growth_investor"
      ],
      "source": "synthetic",
      "as_of": "2026-10-09",
      "quote": null
    },
    "excluded_investors": {
      "value": [],
      "source": "synthetic",
      "as_of": "2026-10-09",
      "quote": null
    },
    "restrictions": {
      "value": [],
      "source": "synthetic",
      "as_of": "2026-10-09",
      "quote": null
    },
    "known_portfolio_conflicts": {
      "value": [],
      "source": "synthetic",
      "as_of": "2026-10-09",
      "quote": null
    },
    "comparable_companies": {
      "value": [
        "Solar Foods"
      ],
      "source": "synthetic",
      "as_of": "2026-10-09",
      "quote": null
    }
  }
}
